url,headline
https://news.err.ee/1610078809/saaremaa-opera-days-open-in-the-courtyard-of-kuressaare-castle,Saaremaa Opera Days open in the courtyard of Kuressaare Castle
https://news.err.ee/1610078884/prime-minister-estonia-can-fund-defense-and-still-cut-spending,Prime minister: Estonia can fund defense and still cut spending
https://news.err.ee/1610078008/us-close-to-resuming-weapons-deliveries-says-estonian-officials,"US 'close' to resuming weapons deliveries, says Estonian officials"
https://news.err.ee/1610078791/estonia-s-cinema-attendance-up-9-000-in-first-half-of-2026,"Estonia's cinema attendance up 9,000 in first half of 2026"
https://news.err.ee/1610078785/highest-uv-index-reading-in-estonia-recorded-in-haapsalu,Highest UV index reading in Estonia recorded in Haapsalu
https://news.err.ee/1610078905/tallinn-airport-sets-new-record-but-fewer-estonians-are-traveling-this-year,"Tallinn Airport sets new record, but fewer Estonians are traveling this year"
https://news.err.ee/1610078746/kristina-schotter-the-limits-of-the-prescription-drug-advertising-ban-need-clarity,Kristina Schotter: The limits of the prescription drug advertising ban need clarity
https://news.err.ee/1610078716/a-first-for-estonia-fully-electric-aircraft-lands-at-tartu-airport,A first for Estonia: Fully electric aircraft lands at Tartu Airport
https://news.err.ee/1610078725/rally-estonia-brings-flight-restrictions-to-south-of-the-country,Rally Estonia brings flight restrictions to south of the country
https://news.err.ee/1610078692/elering-tests-reliability-of-estonia-s-power-system,Elering tests reliability of Estonia's power system
https://news.err.ee/1610077303/russia-plans-to-take-baltics-to-international-court-of-justice-over-alleged-discrimination,Russia plans to take Baltics to International Court of Justice over alleged discrimination
https://news.err.ee/1610078200/archaeologists-find-papal-seal-in-a-courtyard-in-central-tallinn,Archaeologists find papal seal in a courtyard in central Tallinn
https://news.err.ee/1610077954/man-carrying-deactivated-machine-gun-in-tallinn-has-weapon-confiscated,Man carrying deactivated machine gun in Tallinn has weapon confiscated
https://news.err.ee/1610077918/restaurateurs-in-estonia-facing-toughest-conditions-in-30-years,Restaurateurs in Estonia facing 'toughest conditions in 30 years'
https://news.err.ee/1610078050/high-earning-fathers-most-likely-to-use-estonia-s-parental-benefit-while-continuing-to-work,High‑earning fathers most likely to use Estonia's parental benefit while continuing to work
https://news.err.ee/1610077156/estonia-s-most-expensive-apartment-ever-sells-for-4-million,Estonia's most expensive apartment ever sells for €4 million
https://news.err.ee/1610076910/russia-holds-live-fire-exercise-on-lake-peipus-without-informing-estonia,Russia holds live-fire exercise on Lake Peipus without informing Estonia
https://news.err.ee/1610042176/err-showing-fifa-world-cup-2026-final-live,ERR showing FIFA World Cup 2026 final live
https://news.err.ee/1610073649/where-to-watch-the-climax-of-the-fifa-world-cup,Where to watch the climax of the FIFA world cup
https://news.err.ee/1610078128/transport-authority-majority-of-drivers-in-estonia-ignore-traffic-lights,Transport authority: Majority of drivers in Estonia ignore traffic lights
