url,headline
https://news.err.ee/1610083207/health-economists-estonia-s-health-insurance-is-like-the-american-dream,Health economists: Estonia's health insurance is like the American Dream
https://news.err.ee/1610083192/tallinn-cancels-construction-work-contract-for-endla-tanav-tunnels,Tallinn cancels construction work contract for Endla tänav tunnels
https://news.err.ee/1610083168/historic-estonia-e-state-reform-targets-efficiency-not-cuts,"'Historic' Estonia e-state reform targets efficiency, not cuts"
https://news.err.ee/1610083150/police-report-sharp-rise-in-thefts,Police report sharp rise in thefts
https://news.err.ee/1610082625/government-pushes-to-close-unfinished-land-reform,Government pushes to close unfinished land reform
https://news.err.ee/1610082718/coop-pank-and-lhv-see-mixed-fortunes-in-q2-2026,Coop Pank and LHV see mixed fortunes in Q2 2026
https://news.err.ee/1610082691/seto-kingdom-to-be-proclaimed-for-a-day-on-august-1,Seto Kingdom to be proclaimed for a day on August 1
https://news.err.ee/1610082607/estonia-to-shift-to-mostly-two-person-ambulance-crews-by-2028,Estonia to shift to mostly two-person ambulance crews by 2028
https://news.err.ee/1610082682/saaremaa-mass-grave-remains-unmarked-months-after-reburial,Saaremaa mass grave remains unmarked months after reburial
https://news.err.ee/1610082610/gallery-playful-hats-pop-up-on-tartu-statues-for-british-artist-s-new-show,Gallery: Playful hats pop up on Tartu statues for British artist's new show
https://news.err.ee/1610082736/turkish-airlines-suspected-of-using-russian-airspace-on-flight-from-tallinn,Turkish Airlines suspected of using Russian airspace on flight from Tallinn
https://news.err.ee/1610082103/hungary-s-otp-bank-to-buy-luminor,Hungary's OTP Bank to buy Luminor
https://news.err.ee/1610082115/stalin-era-ceiling-mural-covered-up-at-tallinn-cultural-center,Stalin-era ceiling mural covered up at Tallinn cultural center
https://news.err.ee/1610082607/estonia-to-shift-to-mostly-two-person-ambulance-crews-by-2028,Estonia to shift to mostly two-person ambulance crews by 2028
https://news.err.ee/1610082373/rising-insolvencies-could-threaten-estonia-s-internal-security,Rising insolvencies could threaten Estonia's internal security
https://news.err.ee/1610082439/19th-century-estonian-settlers-in-caucasus-linked-malaria-to-hard-work-raw-berries,"19th century Estonian settlers in Caucasus linked malaria to hard work, raw berries"
https://news.err.ee/1610082394/vocational-school-demand-uneven-as-tallinn-questions-girls-interest,Vocational school demand uneven as Tallinn questions girls' interest
https://news.err.ee/1610081680/minister-closure-of-estonia-s-border-with-russia-depends-on-threat-assessment,Minister: Closure of Estonia's border with Russia depends on threat assessment
https://news.err.ee/1610082397/eu-won-t-revise-ets2-commission-official-tells-estonia,"EU won't revise ETS2, Commission official tells Estonia"
https://news.err.ee/1610082331/gallery-european-rc-car-racing-champions-crowned-in-estonia,Gallery: European RC car racing champions crowned in Estonia
