url,headline
https://news.err.ee/1610080936/35th-anniversary-of-restoration-of-estonian-independence-to-see-extensive-events,35th anniversary of restoration of Estonian independence to see extensive events
https://news.err.ee/1610080909/four-treated-for-carbon-monoxide-poisoning-after-visiting-tallinn-spa,Four treated for carbon monoxide poisoning after visiting Tallinn spa
https://news.err.ee/1610080894/estonia-getting-new-british-deployment-tailored-to-its-battlefield-needs,Estonia getting new British deployment tailored to its battlefield needs
https://news.err.ee/1610080558/swan-family-rescued-after-wreaking-havoc-on-busy-tallinn-highway,Swan family rescued after wreaking havoc on busy Tallinn highway
https://news.err.ee/1610080450/sami-pajari-takes-a-clean-sweep-of-rally-estonia-day-one-stages,Sami Pajari takes a clean sweep of Rally Estonia day one stages
https://news.err.ee/1610080570/russia-bans-all-commercial-freight-transport-by-estonia-registered-trucks,Russia bans all commercial freight transport by Estonia-registered trucks
https://news.err.ee/1610080525/estonian-conductor-paavo-jarvi-to-conduct-at-prestigious-bbc-proms,Estonian conductor Paavo Järvi to conduct at prestigious BBC Proms
https://news.err.ee/1610080546/russia-protests-removal-of-valga-county-soviet-war-memorial,Russia protests removal of Valga County Soviet war memorial
https://news.err.ee/1610080495/cider-and-cherry-stones-seven-popular-summer-myths-busted-by-the-experts,Cider and cherry stones: Seven popular summer myths busted by the experts
https://news.err.ee/1610080489/gallery-9th-i-land-sound-festival-opening-day-on-saaremaa,Gallery: 9th I Land Sound festival opening day on Saaremaa
https://news.err.ee/1610080570/russia-bans-all-commercial-freight-transport-by-estonia-registered-trucks,Russia bans all commercial freight transport by Estonia-registered trucks
https://news.err.ee/1610080546/russia-protests-removal-of-valga-county-soviet-war-memorial,Russia protests removal of Valga County Soviet war memorial
https://news.err.ee/1610079790/nolan-s-the-odyssey-won-t-be-shown-in-imax-format-in-estonia,Nolan's 'The Odyssey' won't be shown in IMAX format in Estonia
https://news.err.ee/1610042176/err-showing-fifa-world-cup-2026-final-live,ERR showing FIFA World Cup 2026 final live
https://news.err.ee/1610073649/where-to-watch-the-fifa-world-cup-final,Where to watch the FIFA world cup final
https://news.err.ee/1610079820/estonia-s-peak-tourism-season-arrives-earlier-than-rest-of-europe,Estonia's peak tourism season arrives earlier than rest of Europe
https://news.err.ee/1610080495/cider-and-cherry-stones-seven-popular-summer-myths-busted-by-the-experts,Cider and cherry stones: Seven popular summer myths busted by the experts
https://news.err.ee/1610080438/tartu-exhibition-celebrates-90-years-of-estonia-s-iconic-limpa-lemonade,Tartu exhibition celebrates 90 years of Estonia's iconic Limpa lemonade
https://news.err.ee/1610079793/pedestrian-dies-after-being-hit-by-a-vehicle-in-tallinn-s-mustamae,Pedestrian dies after being hit by a vehicle in Tallinn's Mustamäe
https://news.err.ee/1610080525/estonian-conductor-paavo-jarvi-to-conduct-at-prestigious-bbc-proms,Estonian conductor Paavo Järvi to conduct at prestigious BBC Proms
