url,headline
https://news.err.ee/1610081509/tallinn-takes-movies-outdoors-with-summer-screenings-across-the-city,Tallinn takes movies outdoors with summer screenings across the city
https://news.err.ee/1610081518/estonian-winter-barley-harvest-starts-with-strong-yields,Estonian winter barley harvest starts with strong yields
https://news.err.ee/1610081455/estonian-hunters-deploy-drones-to-keep-african-swine-fever-from-farms,Estonian hunters deploy drones to keep African swine fever from farms
https://news.err.ee/1610081461/gallery-wagner-s-das-rheingold-staged-in-full-for-first-time-at-saaremaa-opera-days,Gallery: Wagner's 'Das Rheingold' staged in full for first time at Saaremaa Opera Days
https://news.err.ee/1610081443/summer-brigades-give-teens-abroad-a-chance-to-work-in-estonia,Summer brigades give teens abroad a chance to work in Estonia
https://news.err.ee/1610081407/ospreys-return-to-western-estonia-as-rivers-recover,Ospreys return to Western Estonia as rivers recover
https://news.err.ee/1610081422/tallinn-plans-elaborate-winter-decorations-across-city-districts,Tallinn plans elaborate winter decorations across city districts
https://news.err.ee/1610081377/drone-defense-system-on-estonia-s-eastern-border-still-in-early-development,Drone‑defense system on Estonia's eastern border still in early development
https://news.err.ee/1610081332/retailer-license-fee-would-increase-alcohol-prices-for-customers,Retailer: License fee would increase alcohol prices for customers
https://news.err.ee/1610080450/toyota-driver-sami-pajari-wins-rally-estonia-after-dominating-weekend,Toyota driver Sami Pajari wins Rally Estonia after dominating weekend
https://news.err.ee/1610080570/russia-bans-all-commercial-freight-transport-by-estonia-registered-trucks,Russia bans all commercial freight transport by Estonia-registered trucks
https://news.err.ee/1610042176/err-showing-fifa-world-cup-2026-final-live,ERR showing FIFA World Cup 2026 final live
https://news.err.ee/1610080546/russia-protests-removal-of-valga-county-soviet-war-memorial,Russia protests removal of Valga County Soviet war memorial
https://news.err.ee/1610080909/four-treated-for-carbon-monoxide-poisoning-after-visiting-tallinn-spa,Four treated for carbon monoxide poisoning after visiting Tallinn spa
https://news.err.ee/1610073649/where-to-watch-the-fifa-world-cup-final,Where to watch the FIFA world cup final
https://news.err.ee/1610080936/35th-anniversary-of-restoration-of-estonian-independence-to-see-extensive-events,35th anniversary of restoration of Estonian independence to see extensive events
https://news.err.ee/1610080954/tallinn-deputy-mayor-suggests-old-town-property-sell-offs-amid-vacancies,Tallinn deputy mayor suggests Old Town property sell-offs amid vacancies
https://news.err.ee/1610080894/estonia-getting-new-british-deployment-tailored-to-its-battlefield-needs,Estonia getting new British deployment tailored to its battlefield needs
https://news.err.ee/1610080450/toyota-driver-sami-pajari-wins-rally-estonia-after-dominating-weekend,Toyota driver Sami Pajari wins Rally Estonia after dominating weekend
https://news.err.ee/1610079790/nolan-s-the-odyssey-won-t-be-shown-in-imax-format-in-estonia,Nolan's 'The Odyssey' won't be shown in IMAX format in Estonia
