url,headline
https://news.err.ee/1610077963/dorm-living-remains-far-cheaper-for-students-as-tallinn-rental-prices-stay-high,Dorm living remains far cheaper for students as Tallinn rental prices stay high
https://news.err.ee/1610077954/man-carrying-deactivated-machine-gun-in-tallinn-has-weapon-confiscated,Man carrying deactivated machine gun in Tallinn has weapon confiscated
https://news.err.ee/1610077918/restaurateurs-in-estonia-facing-toughest-conditions-in-30-years,Restaurateurs in Estonia facing 'toughest conditions in 30 years'
https://news.err.ee/1610078008/us-close-to-resuming-weapons-deliveries-says-estonian-ambassador,"US 'close' to resuming weapons deliveries, says Estonian ambassador"
https://news.err.ee/1610077906/reform-mps-outline-more-than-100-million-in-potential-budget-cuts,Reform MPs outline more than €100 million in potential budget cuts
https://news.err.ee/1610077888/poll-sde-s-rating-surge-stalls,Poll: SDE's rating surge stalls
https://news.err.ee/1610077843/estonian-troops-join-bastille-day-parade-in-paris,Estonian troops join Bastille Day parade in Paris
https://news.err.ee/1610077825/seb-bank-chief-estonia-s-economy-showing-early-recovery,SEB Bank chief: Estonia's economy showing early recovery
https://news.err.ee/1610077351/foreign-seasonal-workers-in-estonia-mainly-head-to-agricultural-jobs,Foreign seasonal workers in Estonia mainly head to agricultural jobs
https://news.err.ee/1610077363/estonia-sees-tourist-boost-in-may,Estonia sees tourist boost in May
https://news.err.ee/1610077303/russia-plans-to-take-baltics-to-international-court-of-justice-over-alleged-discrimination,Russia plans to take Baltics to International Court of Justice over alleged discrimination
https://news.err.ee/1610076910/russia-holds-live-fire-exercise-on-lake-peipus-without-informing-estonia,Russia holds live-fire exercise on Lake Peipus without informing Estonia
https://news.err.ee/1610077156/estonia-s-most-expensive-apartment-ever-sells-for-4-million,Estonia's most expensive apartment ever sells for €4 million
https://news.err.ee/1610077006/foragers-turn-to-social-media-leaving-stores-without-local-blueberries,"Foragers turn to social media, leaving stores without local blueberries"
https://news.err.ee/1610076172/estonia-introduces-new-salary-transparency-requirements,Estonia introduces new salary transparency requirements
https://news.err.ee/1610042176/err-carrying-fifa-world-cup-2026-semifinals-final,"ERR carrying FIFA World Cup 2026 semifinals, final"
https://news.err.ee/1610077084/plastic-wrapped-cucumbers-to-disappear-from-estonia-s-stores,Plastic-wrapped cucumbers to disappear from Estonia's stores
https://news.err.ee/1610073649/where-to-watch-the-climax-of-the-fifa-world-cup,Where to watch the climax of the FIFA world cup
https://news.err.ee/1610077216/estonia-ukraine-drone-deal-implementation-begins-immediately,Estonia–Ukraine drone deal implementation 'begins immediately'
https://news.err.ee/1610077024/medieval-ship-found-in-tallinn-traced-to-lithuanian-builders,Medieval ship found in Tallinn traced to Lithuanian builders
